,id,SKU,type,name,rating_average,price
0,262977989,9650047486657,Tiểu thuyết,Kế Toán Vỉa Hè - Thực Hành Báo Cáo Tài Chính Căn Bản Từ Quầy Bán Nước Chanh,5.0,169000
1,270880693,5642259214295,Truyện tranh,Ai Tăng Lương Cho Bạn? 3 Bí Quyết Đơn Giản Để Thăng Tiến Và Hạnh Phúc Trong Công Việc,5.0,155000
2,000404737,7836360261556,Tiểu thuyết,Kinh Chú Thường Tụng,4.7,95000
3,023416722,3827529234225,Tiểu thuyết,How The Body Works - Hiểu Hết Về Cơ Thể,5.0,256500
4,253393981,3797064945957,Truyện tranh,Think Clean - Đừng tin vào tất cả những gì bạn nghĩ,4.5,179000
5,187827003,3303950228706,Sách giáo khoa,Không Diệt Không Sinh Đừng Sợ Hãi (TB5),5.0,78000
6,074021317,9653845109288,Sách tự truyện,Cây Cam Ngọt Của Tôi,5.0,75000
7,260811707,8836768214519,Sách tự truyện,Muôn Kiếp Nhân Sinh 3 (Bìa Mềm),5.0,144000
8,262434068,3281387034444,Sách tham khảo,"Muôn Kiếp Nhân Sinh - Many Times, Many Lives - Tập 3",5.0,150420
9,003304875,8730236576896,Sách giáo khoa,Điều Kỳ Diệu Của Tiệm Tạp Hóa NAMIYA (Tái Bản),4.8,79000
10,031692405,1369166127303,Hải Tiến,Vở kẻ ngang Haplus - Time,4.8,89000
11,270234757,1798154555162,Tiểu thuyết,Xứ Sở Miên Man,5.0,175000
12,071345381,4227584840532,Tiểu thuyết,Sách Thay Đổi Cuộc Sống Với Nhân Số Học - Lê Đỗ Quỳnh Hương,4.8,173600
13,053434797,2408284983862,Sách giáo khoa,Sách Tài Chính Cá Nhân Cho Người Việt Nam - Tặng Khóa học Online về Tài chính,4.7,200000
14,073179948,1841425604461,Tiểu thuyết,Sách Tự động hóa doanh nghiệp Tập 1,4.6,599000
15,042230121,8105872042430,Sách giáo khoa,Sách Hiểu Về Trái Tim (Tái Bản 2019) - Minh Niệm,4.8,126000
16,207841114,3589664558938,Tiểu thuyết,Ghi Chép Pháp Y – Những Cái Chết Bí Ẩn,5.0,106000
17,052789367,6624824359331,Sách giáo khoa,Nhà Giả Kim (Tái Bản 2020),5.0,56100
18,026114399,9653795675482,Sách nấu ăn,"Nóng Giận Là Bản Năng , Tĩnh Lặng Là Bản Lĩnh",4.8,65000
19,199216988,6863321065071,Sách tự truyện,Càng Bình Tĩnh Càng Hạnh Phúc,5.0,100000
20,186111097,7648066317881,Truyện tranh,Vượt lên trật tự - Tác giả Jordan B. Peterson,4.6,280000
21,055351579,2685298312363,Aron Alpha,"KEO DÁN SIÊU TỐC ARON ALPHA JELLY #31303 - Sản phẩm chất lượng từ Nhật Bản, dán dính tức thì",4.8,79360
22,110758001,3557420497073,Thiên Long,Hộp 10 cây Bút lông kim - Bút mực nước Beebee Thiên Long FL-04 mực tím,4.5,55000
23,031656174,7733665840096,Hải Tiến,Vở kẻ ngang Haplus - Landscape,4.8,100000
24,033172823,6182101595310,Hải Tiến,Vở kẻ ngang Haplus - New Day,4.8,140000
25,207256575,7836369564273,Sách giáo khoa,Định luật Murphy – Mọi bí mật tâm lý thao túng cuộc đời bạn,4.8,85000
26,004780917,6036130164453,Sách tự truyện,Người Đua Diều (Tái Bản 2018),4.8,97000
27,184466860,2733693525196,Truyện tranh,Hành Tinh Của Một Kẻ Nghĩ Nhiều,4.8,62000
28,189643105,3283620562802,Truyện tranh,Không Phải Sói Nhưng Cũng Đừng Là Cừu -Tặng kèm bookmark 2 mặt,4.8,93000
29,157432544,8937200258241,Sách nấu ăn,Giải Thích Ngữ Pháp Tiếng Anh (Với Bài Tập Và Đáp Án) (Tái Bản),5.0,151000
30,003954355,8234253186484,Sách tham khảo,Yêu Những Điều Không Hoàn Hảo,4.8,103000
31,075953557,3981544195117,Sách giáo khoa,Tâm Lý Học Về Tiền,4.8,128000
32,056878836,3332076875808,Sách giáo khoa,Sách Muôn Kiếp Nhân Sinh (Bìa Cứng) - Nguyên Phong,5.0,171000
33,073787185,4451805413940,Sách giáo khoa,Những Tù Nhân Của Địa Lý,4.8,156000
34,109017985,7255202170163,Sách nấu ăn,"Thiên Tài Bên Trái, Kẻ Điên Bên Phải (Tái Bản)",4.8,130000
35,052788072,3056634185207,Tiểu thuyết,Chiến Binh Cầu Vồng (Tái Bản 2020),4.8,81100
36,046240929,5867088230836,Sách giáo khoa,Rèn Luyện Tư Duy Phản Biện,4.8,62900
37,015267827,6068697850982,Sách tự truyện,Hoàng Tử Bé (Tái Bản 2019),5.0,56000
38,106863963,3718408968985,Sách giáo khoa,Tâm Lý Học - Phác Họa Chân Dung Kẻ Phạm Tội,4.8,108000
39,013419678,6193128706009,Sách giáo khoa,Sách Đi Tìm Lẽ Sống (Tái Bản ),4.8,65100
40,248930292,9693688894868,Sách nấu ăn,Đám Trẻ Ở Đại Dương Đen,4.8,73000
41,209891492,1115264531647,Sách tham khảo,Những Người Hàng Xóm - Bản Thường - Bìa Mềm (Tặng kèm Bookmark + Thẻ treo),5.0,84300
42,247858753,6064413839312,Sách nấu ăn,Vùng Đất Quỷ Tha Ma Bắt,5.0,127000
43,117254517,5222628547911,Truyện tranh,Đại Dương Đen - Những Câu Chuyện Từ Thế Giới Của Trầm Cảm,5.0,176000
44,054266567,1347818729174,Tiểu thuyết,Sách Nghĩ Giàu Và Làm Giàu (Bìa Mềm),4.8,81000
45,121635152,1441979095867,Sách nấu ăn,Không Ai Có Thể Làm Bạn Tổn Thương Trừ Khi Bạn Cho Phép (Tặng Kèm 1 Bộ Bookmark Gồm 4 Cái),5.0,86000
46,143217512,1793967042645,Sách tham khảo,Điềm Tĩnh Và Nóng Giận,4.8,70000
47,054748899,6769993970908,Sách tự truyện,Sách Muôn Kiếp Nhân Sinh (Bìa Mềm) - Nguyên Phong,4.8,103000
48,057325187,9148368820975,Tiểu thuyết,Sách Người Giàu Có Nhất Thành Babylon (Tái Bản 2020),5.0,64200
49,105663942,2448443669852,Sách tham khảo,Hành Trình Về Phương Đông (Tái Bản 2021),5.0,76000
50,249157126,9656774504659,Tiểu thuyết,Đứa Trẻ Hiểu Chuyện Thường Không Có Kẹo Ăn,5.0,110000
51,003014291,6632412218199,Casio,Máy Tính Khoa Học Casio FX-580VN X,4.8,664000
52,117238177,3046122770204,Truyện tranh,Thư Viện Nửa Đêm,5.0,115000
53,017336364,8223433558852,Sách nấu ăn,Phía Sau Nghi Can X (Tái Bản 2019),4.8,80100
54,094173462,4089772274675,Sách tham khảo,Muôn Kiếp Nhân Sinh 2,5.0,186000
55,243097256,8912316909681,Sách giáo khoa,Giận (Tái Bản),5.0,106000
56,003639597,9703076562021,Sách tự truyện,Bước Chậm Lại Giữa Thế Gian Vội Vã (Tái Bản),4.8,66000
57,204078065,9933560642767,Tiểu thuyết,Thuật Thao Túng - Góc Tối Ẩn Sau Mỗi Câu Nói,4.8,95400
58,075307228,2281336779503,Sách tham khảo,Sách OSHO Yêu - Being In Love - Yêu Trong Tỉnh Thức,5.0,126000
59,066619715,2529755605097,Sách tự truyện,Sách Vị Tu Sĩ Bán Chiếc Ferrari (Tái Bản),4.8,72100
60,174842858,6741536352899,Truyện tranh,Sách Sức Mạnh Của Ngôn Từ (Tái Bản 2022),5.0,70700
61,002245453,6255173116599,Truyện tranh,Đúng Việc (Tái Bản),5.0,75000
62,003638033,1290542417681,Sách tham khảo,Trăm Năm Cô Đơn,4.8,128000
63,252357065,3158205828569,Truyện tranh,Sách Giáo Khoa Bộ Lớp 12 - Sách Bài Học (Bộ 14 Cuốn) (2023),5.0,172800
64,010005245,9970042779039,Truyện tranh,Đàn Ông Sao Hỏa Đàn Bà Sao Kim,4.8,129000
65,074362508,5905684717068,Sách tham khảo,Thần Số Học Ứng Dụng,4.8,83850
66,205581885,7200368839116,Tiểu thuyết,Ba người thầy vĩ đại (Tái bản),5.0,85100
67,111285062,7209066218492,Sách nấu ăn,Đắc Nhân Tâm (Bìa Mềm)(Tái Bản),4.8,57000
68,050322710,3720031571252,Sách giáo khoa,48 Nguyên Tắc Chủ Chốt Của Quyền Lực (Tái Bản 2020),5.0,160000
69,179546070,3085297338779,Truyện tranh,Luật Hấp Dẫn - Quy Luật Về Sức Mạnh Của Linh Hồn Và Năng Lượng Chữa Lành Cơ Thể Từ Bên Trong,5.0,91100
70,019792256,3714833918766,Sách nấu ăn,Chuyện Con Mèo Dạy Hải Âu Bay (Tái Bản 2019),5.0,37100
71,205574133,3821938737150,Sách tự truyện,Nhân Duyên Tiền Kiếp,4.8,115000
72,161008715,9654761665285,Sách giáo khoa,Power Vs Force - Trường Năng Lượng Và Những Nhân Tố Quyết Định Hành Vi Của Con Người (Tái Bản),5.0,119930
73,076013378,7649903171399,Truyện tranh,Storytelling With Data - Kể Chuyện Thông Qua Dữ Liệu (Cuốn Cẩm Nang Hướng Dẫn Trực Quan Hóa Dữ Liệu),5.0,222000
74,091947689,9849183363227,Tiểu thuyết,Sách PACE Books - 7 Thói quen hiệu quả (The 7 Habits Of Highly Effective People) (Tái Bản) - Stephen,5.0,200000
75,252770233,3097085086290,Truyện tranh,Vẻ Đẹp Của Sự Cô Đơn,5.0,95100
76,142002263,5952706444635,Sách tự truyện,Muôn Kiếp Nhân Sinh 2 (Bìa Cứng),5.0,234000
77,124767703,8800240678494,Tiểu thuyết,Cân Bằng Cảm Xúc Cả Lúc Bão Giông (Tặng Kèm Bookmark)(Tái Bản),5.0,77100
78,147999778,8760696978124,Sách tham khảo,Không Bao Giờ Là Thất Bại - Tất Cả Là Thử Thách (Ấn Bản Cập Nhật Đầy Đủ Nhất)(Bìa Cứng),5.0,165000
79,253360429,5568136914674,Tiểu thuyết,38 Lá Thư Tỷ Phú John Davison Rockefeller Gửi Cho Con Trai,5.0,158000
80,008885999,3437458435998,Tiểu thuyết,Totto - Chan Bên Cửa Sổ (Tái Bản),5.0,73100
81,260810302,3925872492685,Tiểu thuyết,Ngôi thứ nhất số ít,5.0,81100
82,022881852,5587108239013,Truyện tranh,English Grammar in Use Book w Ans,5.0,163760
83,168283405,7064320451538,Sách nấu ăn,Chiến Tranh Tiền Tệ - Phần 1 - Ai Thực Sự Là Người Giàu Nhất Thế Giới ( Tái Bản 2022),5.0,124000
84,100321478,2142071726066,Sách tự truyện,Muốn An Được An (Tái bản 2021),5.0,46098
85,198414891,2348484474478,Sách giáo khoa,Hồ Sơ Tâm Lý Học Tâm Thần Hay Kẻ Điên,4.8,136000
86,185067342,9193694003186,Sách tham khảo,Tô Bình Yên Vẽ Hạnh Phúc (Tái Bản),5.0,62100
87,248446185,1847645111105,Sách tự truyện,Combo Sách Muôn Kiếp Nhân Sinh Tập 1 + Không Diệt Không Sinh Đừng Sợ Hãi (Bộ 2 Cuốn),5.0,194600
88,012377498,4354517001149,Sách tham khảo,Bố Con Cá Gai (Tái Bản 2019),5.0,71100
89,188940817,4862841472489,Sách giáo khoa,Vị Thần Của Những Quyết Định,4.8,55100
90,228989363,5688485504899,Sách nấu ăn,Hiểu Về Trái Tim (Tái Bản 2023),5.0,126400
91,262301191,3414702066335,Tiểu thuyết,Combo Muôn Kiếp Nhân Sinh 3 Tập,5.0,480000
92,197263858,7287613296112,Sách giáo khoa,Sách Excel Ứng Dụng Văn Phòng ĐÀO TẠO TIN HỌC Từ Cơ Bản Đến Nâng Cao Có Kèm Video Khóa Học,5.0,188100
93,111580006,1827948477337,Tiểu thuyết,Sách Muôn Kiếp Nhân Sinh 2 (Khổ Nhỏ) - Nguyên Phong,5.0,111000
94,107802183,5771954109656,Sách giáo khoa,Sách Sức Mạnh Tiềm Thức (Tái Bản) (Bìa Mềm),5.0,96100
95,215141307,8723906717302,Sách nấu ăn,Người dọn dẹp hiện trường án mạng,5.0,65000
96,010095276,6693741932118,Sách tự truyện,Ikigai - Bí Mật Sống Trường Thọ Và Hạnh Phúc Của Người Nhật,5.0,68000
97,004313653,8935278601494,Sách nấu ăn,Từng Bước Nở Hoa Sen,5.0,59100
98,113530805,8928093278897,Truyện tranh,Tuổi Trẻ Đáng Giá Bao Nhiêu (Tái Bản),4.8,67000
99,094173458,3408429279209,Sách nấu ăn,Khuyến Học (Tái Bản),5.0,51000
100,251577060,5720404971426,Sách tham khảo,Người Bà Tài Giỏi Vùng Saga – Tập 11,4.7,43000
101,262871376,8803574087784,Truyện tranh,Arya Bàn Bên Thỉnh Thoảng Lại Trêu Ghẹo Tôi Bằng Tiếng Nga – Tập 3,4.5,89100
102,152875147,6835131276097,Sách nấu ăn,Miền Đất Hứa - Barack Obama (Bìa Cứng),5.0,477300
103,248264491,8009267806557,Sách giáo khoa,Bộ Sách Hiểu Về Trái Tim Và Không Diệt Không Sinh Đừng Sợ Hãi (Tái Bản 2023),5.0,214400
104,008886001,6743728276916,Sách tự truyện,Giết Con Chim Nhại (Tái Bản),4.8,94000
105,210277880,4393546061013,Sách tự truyện,Con người và Biểu tượng - Man and his symbols,4.8,381000
106,253099216,5916298060000,Sách nấu ăn,Khó Dỗ Dành 1,4.8,148000
107,261028263,6766276850463,Sách giáo khoa,Chú Thuật Hồi Chiến Tập 13: Biến Cố Shibuya – Sấm Rền,4.6,27100
108,070016692,6701145185686,Sách tự truyện,Bắt Trẻ Đồng Xanh (Tái Bản 2020),4.8,69100
109,097594364,4239288860375,Tiểu thuyết,Luật Tâm Thức - Giải Mã Ma Trận Vũ Trụ,4.7,211000
110,225912339,9241833835447,Sách tự truyện,Chủ nghĩa khắc kỷ - phong cách sống bản lĩnh và bình thản (Tái Bản),5.0,96850
111,103379147,1415668052071,Sách tự truyện,Bạch Dạ Hành (Tái Bản),4.8,163000
112,176752838,1858413556074,Sách nấu ăn,Thay Đổi Tí Hon Hiệu Quả Bất Ngờ - Atomic Habits,5.0,159690
113,013833466,5466785722172,Sách nấu ăn,Sách Minh Triết Trong Ăn Uống Của Phương Đông (Tái Bản),5.0,125500
114,054614797,7637794121043,Tiểu thuyết,"Có Một Ngày, Bố Mẹ Sẽ Già Đi",4.8,70900
115,000750578,2505284296418,Sách tự truyện,Khi Hơi Thở Hóa Thinh Không,4.7,75000
116,003608623,8836216508779,Sách nấu ăn,Bí Mật Của Phan Thiên Ân,4.8,69000
117,139303869,8894786964901,Sách tham khảo,Nghệ Thuật Tinh Tế Của Việc Đếch Quan Tâm (Tái Bản),5.0,94000
118,008885995,8297872277278,Sách giáo khoa,Sự Im Lặng Của Bầy Cừu (Tái Bản),4.8,88100
119,095311757,2443406206869,Sách tự truyện,Lưu Thông Máu Tốt Hóa Giải Bách Bệnh,4.8,72000
120,204051994,2072179233402,Sách tham khảo,Ngôi nhà kỳ quái,5.0,102000
121,049747007,5649979940099,Sách nấu ăn,Hai Mặt Của Gia Đình,4.8,71000
122,126743459,4806302484477,Tiểu thuyết,Fear - Sợ Hãi (Hóa Giải Sợ Hãi Bằng Tình Thương),5.0,76300
123,001476937,2707336164304,Truyện tranh,Dám Bị Ghét,4.8,74000
124,249019417,8396009001616,Sách tham khảo,Đường Xưa Mây Trắng - Theo Gót Chân Bụt (Tái Bản),5.0,234000
125,121635154,7788980927848,Sách tự truyện,Điều Đẹp Nhất Có Khi Là Buông Tay (Tặng Kèm Bookmark),4.8,53000
126,069644748,2023534474138,Truyện tranh,Thiền Sư Và Em Bé 5 Tuổi,5.0,93000
127,109765020,4285464450705,Truyện tranh,Siddhartha (Tái Bản 2021),5.0,53500
128,140416373,3988684296835,Tiểu thuyết,Hành Trình Về Phương Đông (Khổ Nhỏ)(Tái Bản),5.0,60000
129,217536280,7178251233849,Sách nấu ăn,999 Lá Thư Gửi Cho Chính Mình – Những lá thư ấn tượng nhất (Phiên bản song ngữ Trung - Việt),5.0,73100
130,176909221,2474480684348,Sách nấu ăn,Ngôi Nhà Bên Bờ Biển Xanh Thẳm,5.0,125000
131,111290700,6251612446075,Sách tự truyện,Bố Già (Bìa Cứng) (Tái Bản),5.0,195000
132,085396163,6812303160772,Tiểu thuyết,Combo 2 Cuốn: Yêu Những Điều Không Hoàn Hảo + Bước Chậm Lại Giữa Thế Gian Vội Vã (Tái Bản),5.0,179000
133,216124178,4037249309541,Tiểu thuyết,Muối – Sự Hồi Sinh Nơi Sâu Thẳm Vụn Vỡ,4.7,119000
134,072882553,6676263602455,Sách giáo khoa,Kỷ Luật Tự Giác (Tặng Kèm Bookmark ),4.8,62000
135,207301603,2698647703750,Sách tự truyện,Thiên Quan Tứ Phúc - Tập 7,5.0,110700
136,063587072,2462009899777,Sách tham khảo,Tĩnh Lặng (Tái Bản Lần Thứ 11/2020),5.0,49100
137,154245455,1211693367902,Sách giáo khoa,Combo 2 Cuốn Nghiền Từ Vựng Tiếng Anh: Học Qua Gốc Từ Bằng Hình Ảnh - Gốc Từ Là Bí Quyết Để Ghi Nhớ ,5.0,215000
138,213619207,3024960208107,Sách tham khảo,Sách Lời Tiên Tri Celestine - First News,5.0,193440
139,109018530,8127580547496,Sách giáo khoa,Vườn Hoa Mạt Dược Ký Sự - Những Kỳ Án Nổi Tiếng Chưa Có Lời Giải (Tặng Kèm 1 Bookmark Chữ Nhật),4.8,103000
140,100347901,9090972971881,Sách giáo khoa,Tam Thể 1 (Tái Bản),4.8,112000
141,242770600,7180981958182,Sách tự truyện,Người Bà Tài Giỏi Vùng SaGa - Tập 10,4.7,42100
142,120219394,9480037619793,Tiểu thuyết,Tôi Nói Gì Khi Nói Về Chạy Bộ,5.0,56100
143,252884444,7794323034634,Sách nấu ăn,Sách Giáo Khoa Bộ Lớp 12 - Sách Bài Học (Bộ 13 Cuốn - Không Tiếng Anh) (2023),5.0,156480
144,111290696,2267993118143,Sách nấu ăn,Việt Nam Sử Lược (Ấn Bản Kỉ Niệm 100 Năm Xuất Bản Lần Đầu) (Tái Bản),5.0,360000
145,008886007,7249937411821,Sách giáo khoa,Ngàn Mặt Trời Rực Rỡ (Tái Bản),4.8,96100
146,066067655,1366097861023,Sách giáo khoa,Trải Nghiệm Khách Hàng Xuất Sắc,5.0,177000
147,100958457,9002120397309,Sách giáo khoa,Gieo Trồng Hạnh Phúc (Tái Bản),5.0,57000
148,059262880,9235463056504,Sách tự truyện,Sách Người Bán Hàng Vĩ Đại Nhất Thế Giới (Tái Bản 2020),4.8,96000
149,073125816,1048543996878,Sách giáo khoa,Digital Marketing - Từ Chiến Lược Đến Thực Thi (Tái Bản 2020),4.8,144000
150,104741661,8622419823285,Sách tự truyện,Combo 2 Tập : 999 Lá Thư Gửi Cho Chính Mình (Tái Bản),5.0,182000
151,069764541,9932851704459,Sách nấu ăn,Tâm Lý Học Hành Vi (Tặng Kèm 1 Bookmark ),5.0,68100
152,077774625,3059987340603,Sách tự truyện,"Nghệ Thuật Tập Trung - Nâng Cao Năng Suất, Tối Ưu Thời Gian, Hiệu Quả Bất Ngờ",4.8,73000
153,052329763,4665215905746,Sách nấu ăn,Kafka bên bờ biển (Tái Bản 2020),4.8,118500
154,106185389,9559033067230,Sách tự truyện,Tổng ôn ngữ pháp Tiếng Anh cô Trang Anh- Sách luyện thi THPT Quốc gia môn tiếng anh ,4.8,184000
155,095289208,1464786139511,Tiểu thuyết,Người Bà Tài Giỏi Vùng Saga,5.0,93000
156,019662184,1430481594771,Sách tự truyện,Một Lít Nước Mắt (Tái Bản 2019),4.8,59100
157,249160355,5841986658584,Tiểu thuyết,Dưới Cánh Cửa Thầm Thì,5.0,150000
158,208289515,4724191436367,Tiểu thuyết,Một cuốn sách trầm cảm,4.8,78100
159,090622579,8675814753928,Truyện tranh,Tâm Lý Học - Nghệ Thuật Giải Mã Hành Vi,4.8,116000
160,214186189,4163205733004,Sách tự truyện,Tư Duy Nhanh Và Chậm (Tái Bản),4.8,186000
161,170463582,5109113574987,Sách tham khảo,Siêu Nhí Biết Tuốt - 101 Bí Ẩn Kích Thích Tò Mò Của Các Bạn Nhỏ,5.0,98889
162,145288026,9932653478147,Tiểu thuyết,Chia Rẽ - Tại Sao Chúng Ta Đang Sống Trong Thời Đại Của Những Bức Tường,4.8,149000
163,206479088,4130396405529,Truyện tranh,Sách Dám Nghĩ Lại - First News,5.0,126000
164,011368965,1537261590166,Sách giáo khoa,Combo Giáo Trình Chuẩn HSK 1 - Bài Học (Kèm 1 MP3) và Giáo Trình Chuẩn HSK 1 - Bài Tập (Kèm 1 MP3) (,5.0,302600
165,174377494,7839215446589,Sách nấu ăn,Combo 10 cuốn Ehon Ươm mầm Tính cách,4.8,132000
166,127844385,4778983208702,Tiểu thuyết,Kiêu Hãnh Và Định Kiến (Tái Bản),4.8,91100
167,008965213,2567808619028,Sách giáo khoa,The Magic - Phép màu,4.8,156000
168,173093879,6324102988475,Sách tự truyện,"Liễu Phàm Tứ Huấn - Tích Tập Phúc Đức, Cải Tạo Vận Mênh (Tái Bản 2022)",5.0,44250
169,143186001,9605309945791,Sách nấu ăn,Chiến Thắng Con Quỷ Trong Bạn - Bí Quyết Tự Do Và Thành Công (Tái Bản),4.8,82000
170,253213647,3301899555005,Sách tự truyện,Triêu Du (tập 2),5.0,149000
171,000641906,2510730215059,Sách giáo khoa,Bí Mật Của Naoko,4.7,84000
172,138107485,5799209507223,Truyện tranh,Mặt Dày Tâm Đen (Tái Bản),5.0,126000
173,076776245,4417746830981,Sách tham khảo,Nghệ Thuật Tư Duy Phản Biện,4.8,91100
174,055319105,5969947003350,Tiểu thuyết,Những Quy Luật Của Bản Chất Con Người,4.8,235000
175,072308265,9349072785301,Sách tự truyện,Hoa Vẫn Nở Mỗi Ngày,4.8,183000
176,047342678,4630413736195,Sách giáo khoa,Không Giới Hạn - Khám Phá HO'OPONOPONO,5.0,115000
177,124767704,3819100744435,Sách giáo khoa,Bạn Đắt Giá Bao Nhiêu? (Tái Bản),5.0,84000
178,190238356,2389028150709,Sách giáo khoa,Kỷ Luật Bản Thân,4.7,134000
179,155550591,8331625598273,Sách giáo khoa,Dinh Dưỡng Học Bị Thất Truyền - Dinh Dưỡng Đẩy Lùi Bệnh Tật,5.0,130000
180,085763211,1667972248790,Sách tham khảo,Hãy Khiến Tương Lai Biết Ơn Vì Hiện Tại Bạn Đã Cố Gắng Hết Mình (Tặng Kèm: 01 Bookmark),5.0,71100
181,011371249,4840421383186,Truyện tranh,Chuyện Con Mèo Và Con Chuột Bạn Thân Của Nó - Tái Bản,5.0,29000
182,007827502,6956612875489,Truyện tranh,Chiến Tranh Không Có Một Khuôn Mặt Phụ Nữ (Tái bản),4.8,102000
183,054422942,2444863575127,Truyện tranh,Tôi Quyết Định Sống Cho Chính Tôi (Tái Bản 2020),5.0,59100
184,002455543,5305086831813,Sách giáo khoa,Không Diệt Không Sinh Đừng Sợ Hãi,5.0,88000
185,021367457,7303752853270,Sách tự truyện,Tôn Tử Binh Pháp ( Tái Bản ),4.8,59000
186,212992673,1249118452904,Sách tham khảo,Bức Họa Múa Rối Xương (Combo tập 3 + 4),4.8,209000
187,072459686,8020227397709,Tiểu thuyết,How Psychology Works - Hiểu Hết Về Tâm Lý Học,4.8,228000
188,074341297,1638357424539,Tiểu thuyết,Không Sợ Chậm Chỉ Sợ Dừng,5.0,95000
189,219148748,2274387064455,Sách giáo khoa,Chú bé mang Pyjama sọc,5.0,59000
190,158019962,7155551663521,Sách tham khảo,Combo 3 Cuốn Bộ Sách: Nuôi Con Không Phải Là Cuộc Chiến 2 (Tái Bản),5.0,245050
191,010920495,3194948182656,Sách nấu ăn,Dế Mèn Phiêu Lưu Ký,5.0,119000
192,100947274,9056182518807,Sách tham khảo,Tìm Bình Yên Trong Gia Đình (Tái Bản),5.0,68310
193,157240665,6952703411267,Sách tự truyện,Ra Bờ Suối Ngắm Hoa Kèn Hồng (Truyện Dài-Nguyễn Nhật Ánh) - Bìa Mềm (Màu Hồng) (Tặng Kèm Bookmark Bồ,5.0,112000
194,206676975,2939898937004,Tiểu thuyết,1000 Phát Minh Và Khám Phá Vĩ Đại,5.0,348000
195,253194702,8529516951682,Tiểu thuyết,Vẻ Đẹp Của Sự Cô Đơn - Tặng Kèm Bookmark,0.0,108000
196,095218451,1227243257828,Sách giáo khoa,Lần Đầu Làm Mẹ - Tổng Hợp Những Kiến Thức Mới Nhất Về Mang Thai Và Sinh Nở (Tái Bản),5.0,174200
197,261038020,2880140662152,Sách nấu ăn,Cây Nấm Nhỏ (tập 1),4.6,136000
198,090056907,8035469938067,Sách giáo khoa,Khởi Nghiệp Tinh Gọn (The Lean Startup) (Tái Bản),5.0,108000
199,032490132,5574151134181,Sách tham khảo,Một Đời Như Kẻ Tìm Đường,4.8,143000
